{
 "as_of": "2026-10-27",
 "fetched_at": "2026-10-28T21:39:05Z",
 "generated_at": "2026-10-28T21:39:05Z",
 "history": {
  "brent": [
   66.04,
   69.91,
   69.85,
   74.14,
   73.14,
   72.56,
   73.76,
   76.28,
   75.19,
   71.3,
   72.58,
   70.49,
   64.3,
   60.23,
   58.81,
   60.68,
   57.93,
   58.97,
   57.94,
   57.99,
   56.55,
   59.18,
   57.01,
   58.66,
   64.74,
   63.67,
   62.91,
   63.13,
   60.7,
   52.82,
   49.95,
   50.83,
   55.67,
   56.93,
   57.21,
   56.78,
   60.38,
   61.18,
   60.25,
   60.93,
   63.1,
   68.47,
   69.15,
   68.78,
   66.34,
   67.28,
   65.14,
   65.18,
   69.26,
   70.72,
   68.65,
   70.04,
   71.63,
   72.04,
   72.22,
   76.58,
   78.12,
   79.09,
   76.58,
   75.36,
   69.57,
   69.8,
   69.49,
   72.29,
   75.08,
   78.27,
   78.91,
   80.97,
   79.05,
   80.82,
   84.25,
   84.71,
   92.11,
   92.32,
   91.99,
   95.33,
   88.71,
   88.46,
   91.86,
   91.03,
   95.92,
   96.87,
   91.86,
   89.66,
   90.96,
   91.41,
   91.45,
   96.96,
   96.07,
   100.9,
   104.66,
   109.16,
   99.78,
   102.68,
   102.21,
   107.15,
   110.67,
   116.62,
   111.92,
   123.54,
   122.98,
   129.72,
   127.85,
   132.81,
   134.29,
   134.28,
   139.38,
   143.95,
   143.68,
   129.34,
   124.7,
   124.16,
   113.03,
   108.8,
   113.99,
   113.49,
   102.51,
   94.37,
   93.46,
   100.88,
   88.95,
   74.58,
   66.05,
   60.57,
   60.0,
   56.84,
   50.7,
   44.91,
   47.72,
   37.04,
   42.38,
   39.52,
   33.73,
   42.94,
   42.34,
   43.42,
   43.13,
   44.17,
   44.49,
   43.36,
   42.19,
   45.15,
   43.48,
   44.97,
   49.27,
   50.81,
   50.48,
   52.33,
   52.02,
   50.29,
   51.75,
   56.02,
   56.33,
   58.7,
   64.98,
   67.77,
   70.62,
   70.48,
   68.1,
   65.74,
   58.43,
   63.54,
   68.82,
   70.08,
   74.21,
   71.33,
   73.71,
   72.8,
   65.84,
   68.76,
   70.72,
   64.6,
   66.5,
   69.45,
   74.58,
   77.72,
   74.91,
   75.51,
   74.81,
   75.61,
   76.0,
   77.74,
   70.07,
   71.87,
   75.15,
   77.91,
   80.06,
   76.85,
   72.73,
   71.2,
   71.3,
   71.49,
   76.88,
   76.36,
   79.2,
   79.38,
   78.37,
   77.98,
   82.63,
   82.77,
   84.81,
   86.09,
   86.19,
   76.48,
   76.43,
   70.45,
   73.0,
   71.84,
   73.28,
   77.05,
   76.21,
   71.75,
   75.2,
   75.55,
   77.27,
   77.5,
   81.28,
   75.14,
   73.48,
   75.16,
   75.03,
   77.54,
   77.43,
   78.73,
   82.69,
   83.88,
   81.94,
   80.75,
   82.47,
   87.05,
   86.07,
   83.17,
   84.78,
   90.65,
   89.54,
   91.11,
   93.63,
   93.23,
   94.25,
   97.86,
   96.84,
   97.06,
   99.43,
   99.93,
   102.2,
   111.47,
   115.71,
   114.07,
   114.13,
   115.45,
   118.63,
   122.9,
   124.63,
   121.69,
   126.59,
   124.01,
   115.66,
   112.54,
   110.13,
   115.09,
   118.71,
   120.49,
   108.27,
   107.57,
   117.4,
   118.06,
   118.25,
   115.93,
   106.92,
   108.17,
   108.36,
   112.29,
   115.92,
   115.1,
   116.26,
   109.17,
   105.42,
   104.38,
   114.33,
   111.6,
   110.01,
   112.22,
   114.43,
   107.82,
   106.08,
   109.59,
   107.91,
   104.0,
   109.28,
   108.09,
   111.96,
   109.88,
   108.5,
   110.5,
   112.56,
   118.13,
   120.69,
   124.89,
   125.93,
   128.08,
   125.09,
   125.21,
   123.41,
   123.58,
   120.62,
   118.08,
   119.3,
   111.66,
   112.5,
   108.03,
   107.86,
   98.63,
   97.57,
   97.13,
   89.22,
   94.17,
   98.5,
   101.91,
   106.98,
   106.3,
   109.57,
   113.13,
   115.2,
   115.76,
   113.93,
   113.64,
   117.48,
   111.27,
   111.36,
   112.17,
   115.17,
   111.89,
   108.9,
   106.79,
   108.61,
   106.81,
   110.14,
   110.84,
   107.16,
   109.28,
   109.13,
   110.05,
   112.58,
   110.3,
   111.71,
   113.88,
   115.55,
   118.9,
   117.4,
   113.74,
   110.14,
   108.91,
   109.32,
   106.51,
   108.46,
   103.98,
   100.58,
   98.94,
   102.39,
   104.6,
   101.31,
   103.83,
   101.24,
   100.43,
   104.07,
   105.1,
   100.36,
   102.49,
   107.46,
   109.03,
   109.34,
   107.57,
   109.63,
   108.49,
   111.82,
   112.12,
   115.97,
   117.15,
   113.31,
   110.22,
   109.45,
   109.42,
   110.65,
   109.4,
   105.7,
   105.78,
   104.29,
   108.25,
   111.36,
   111.07,
   111.5,
   108.08,
   112.15,
   112.06,
   106.57,
   106.44,
   108.45,
   109.14,
   108.16,
   110.12,
   108.63,
   109.03,
   108.98,
   109.14,
   108.08,
   107.2,
   106.64,
   106.41,
   107.34,
   109.79,
   109.53,
   109.48,
   108.26,
   110.9,
   110.19,
   109.21,
   109.21,
   113.15,
   114.55,
   112.62,
   108.98,
   105.77,
   106.03,
   106.89,
   103.45,
   103.36,
   101.13,
   100.09,
   101.12,
   99.51,
   96.31,
   96.75,
   95.08,
   90.8,
   88.66,
   85.27,
   86.0,
   84.17,
   83.2,
   77.51,
   79.2,
   71.89,
   68.0,
   61.67,
   58.87,
   58.72,
   55.38,
   47.64,
   47.38,
   46.69,
   47.52,
   55.88,
   60.33,
   60.99,
   61.89,
   59.15,
   54.8,
   53.88,
   56.44,
   55.73,
   56.82,
   61.31,
   62.96,
   64.13,
   63.82,
   64.69,
   64.7,
   63.16,
   60.36,
   63.19,
   59.41,
   60.14,
   61.73,
   57.72,
   56.38,
   54.29,
   53.29,
   47.54,
   47.79,
   43.84,
   47.97,
   48.59,
   46.87,
   47.28,
   47.28,
   46.55,
   52.08,
   48.96,
   46.3,
   48.0,
   46.09,
   41.98,
   42.49,
   43.07,
   41.44,
   36.99,
   36.76,
   37.22,
   36.61,
   31.67,
   28.8,
   30.46,
   33.14,
   32.35,
   31.8,
   31.66,
   35.76,
   37.61,
   39.41,
   39.26,
   38.33,
   36.42,
   40.71,
   41.32,
   43.97,
   45.64,
   44.6,
   47.05,
   48.54,
   49.09,
   48.5,
   49.7,
   46.57,
   46.69,
   47.65,
   44.53,
   46.25,
   44.24,
   40.76,
   42.47,
   45.12,
   49.39,
   49.66,
   45.96,
   48.37,
   45.26,
   46.71,
   48.24,
   50.49,
   48.87,
   50.28,
   47.78,
   43.06,
   41.61,
   44.41,
   46.32,
   52.35,
   52.19,
   54.15,
   53.93,
   54.96,
   55.9,
   54.37,
   55.04,
   54.8,
   55.92,
   55.2,
   54.48,
   54.69,
   54.12,
   50.63,
   50.58,
   49.97,
   52.2,
   54.24,
   55.05,
   49.93,
   49.46,
   47.45,
   49.08,
   52.78,
   50.84,
   48.46,
   46.64,
   45.7,
   44.14,
   47.08,
   46.47,
   47.89,
   47.47,
   52.0,
   52.48,
   51.47,
   50.96,
   51.87,
   53.15,
   54.55,
   56.18,
   58.16,
   57.02,
   55.5,
   56.86,
   57.89,
   60.15,
   61.42,
   64.35,
   61.34,
   63.58,
   64.57,
   63.86,
   63.81,
   64.61,
   66.73,
   68.01,
   69.64,
   68.56,
   70.08,
   67.45,
   63.04,
   64.3,
   67.04,
   64.26,
   65.19,
   64.68,
   69.03,
   69.02,
   66.51,
   73.18,
   74.62,
   75.33,
   74.75,
   77.37,
   78.38,
   76.6,
   74.54,
   75.11,
   72.02,
   73.67,
   77.44,
   74.98,
   74.11,
   71.99,
   74.84,
   72.48,
   71.0,
   70.14,
   74.41,
   76.94,
   75.55,
   77.87,
   78.9,
   82.72,
   85.12,
   80.71,
   80.38,
   77.4,
   71.11,
   69.01,
   65.29,
   61.65,
   57.71,
   61.71,
   58.56,
   51.93,
   50.57,
   55.64,
   59.24,
   62.04,
   61.49,
   61.86,
   61.37,
   65.65,
   66.91,
   63.71,
   65.66,
   66.11,
   66.29,
   67.93,
   69.93,
   71.57,
   70.71,
   71.03,
   71.95,
   71.63,
   73.94,
   67.98,
   66.78,
   64.1,
   63.13,
   65.99,
   67.52,
   63.53,
   66.65,
   61.04,
   62.46,
   61.12,
   57.37,
   59.0,
   58.64,
   61.04,
   61.28,
   61.25,
   65.23,
   62.48,
   59.13,
   60.59,
   59.96,
   62.06,
   60.17,
   62.0,
   63.32,
   64.83,
   65.03,
   66.5,
   67.44,
   68.66,
   68.91,
   69.08,
   66.77,
   64.05,
   59.34,
   57.77,
   54.53,
   57.37,
   58.6,
   51.31,
   45.6,
   32.25,
   25.55,
   22.39,
   24.33,
   20.23,
   19.75,
   15.87,
   18.49,
   24.23,
   30.95,
   33.8,
   34.15,
   41.0,
   38.54,
   42.33,
   40.97,
   43.19,
   43.27,
   43.53,
   43.29,
   43.13,
   44.07,
   44.86,
   43.94,
   45.22,
   41.1,
   38.8,
   42.16,
   40.91,
   38.0,
   41.63,
   41.34,
   40.71,
   36.33,
   38.08,
   41.51,
   43.79,
   47.3,
   49.1,
   50.01,
   52.17,
   50.88,
   51.22,
   55.51,
   54.8,
   55.22,
   55.25,
   59.48,
   62.47,
   62.84,
   65.86,
   69.95,
   68.87,
   64.0,
   63.77,
   63.85,
   61.89,
   65.98,
   65.75,
   67.73,
   68.73,
   69.24,
   66.72,
   69.36,
   71.3,
   72.05,
   73.1,
   76.45,
   77.51,
   77.14,
   74.46,
   74.86,
   77.72,
   71.02,
   70.9,
   65.51,
   72.26,
   73.07,
   72.44,
   74.64,
   77.42,
   79.4,
   82.17,
   84.67,
   85.43,
   83.1,
   82.43,
   82.9,
   80.24,
   82.37,
   70.71,
   74.98,
   72.97,
   76.26,
   77.24,
   82.28,
   87.17,
   89.75,
   91.47,
   96.86,
   97.5,
   96.18,
   98.56,
   123.86,
   118.11,
   114.32,
   122.67,
   106.13,
   101.26,
   110.83,
   105.15,
   108.36,
   113.86,
   112.12,
   113.63,
   121.19,
   125.68,
   127.44,
   119.22,
   117.36,
   119.21,
   113.95,
   112.26,
   106.77,
   111.51,
   100.31,
   103.7,
   96.45,
   101.13,
   93.09,
   91.68,
   89.43,
   84.29,
   88.9,
   98.88,
   92.22,
   91.82,
   94.64,
   99.53,
   94.25,
   88.93,
   83.4,
   86.54,
   76.37,
   80.2,
   82.45,
   82.82,
   76.41,
   83.43,
   86.96,
   85.36,
   78.85,
   85.46,
   81.97,
   82.31,
   85.74,
   82.3,
   71.03,
   73.63,
   79.19,
   86.56,
   87.31,
   83.36,
   81.32,
   75.85,
   74.54,
   75.42,
   76.33,
   76.0,
   74.74,
   76.76,
   73.56,
   74.51,
   78.77,
   79.9,
   81.06,
   84.49,
   87.38,
   87.93,
   85.92,
   85.42,
   89.98,
   91.85,
   95.55,
   93.99,
   95.86,
   87.86,
   94.33,
   93.72,
   90.73,
   87.55,
   81.74,
   81.22,
   79.82,
   78.72,
   75.94,
   76.84,
   80.23,
   77.69,
   78.31,
   79.89,
   80.71,
   83.34,
   79.54,
   83.58,
   84.88,
   84.18,
   84.82,
   84.29,
   85.39,
   84.87,
   86.17,
   92.81,
   93.12,
   87.96,
   89.95,
   83.6,
   83.39,
   82.24,
   78.92,
   79.41,
   78.12,
   81.49,
   86.42,
   87.26,
   88.66,
   87.35,
   85.19,
   81.35,
   78.35,
   81.07,
   81.56,
   80.34,
   80.2,
   72.82,
   73.68,
   75.96,
   71.63,
   79.32,
   80.27,
   72.75,
   75.62,
   73.63,
   74.04,
   73.45,
   76.1,
   74.16,
   73.78,
   74.89,
   73.19,
   73.77,
   76.72,
   79.76,
   83.02,
   78.71,
   77.11,
   74.68,